{
  "forsendelse": {
    "meldingsId": "2CB6929E-DE3F-49A4-8AE3-9625640DF0AA",
    "sendtTid": "2022-07-06T16:35:00+02:00",
    "avsender": {
      "organisasjon": {
        "organisasjonsnummer": "826726342",
        "navn": "Buskerud tingrett"
      },
      "person": {
        "etternavn": "Saksbehandler",
        "fornavn": "Litt",
        "tittel": "Saksbehandler"
      }
    },
    "mottaker": {
      "organisasjon": {
        "organisasjonsnummer": "983997953",
        "navn": "Innlandet politidistrikt"
      }
    }
  },
  "lukkeKategori": "DUPLIKAT",
  "beskrivelse": "Lukker denne saken da vi mottok to begjæringer på samme sak fra politiet",
  "saksInformasjon": {
    "saksnummer": "22-025462ENE-TBUS/TDRA",
    "straffesaksnummer": "15434820",
    "kravId": "16972F79-0A35-4EC7-90A1-81E4EFAE1EAA"
  }
}
